{
  "schema_version": 2,
  "id": "20261006T152709Z-ef02fa4",
  "created_at": "2026-10-06T15:27:09.887Z",
  "repository": {
    "name": "pi-evidence",
    "origin": "https://github.com/libre-ai/pi-evidence.git"
  },
  "revision": {
    "head": "ef02fa42c28264c05852ac804270c14ef9423e5e",
    "branch": "fix/fleet-governance-metadata",
    "dirty": false,
    "changed_files": [],
    "status_sha256": "e3b0c44298fc1c149afbf4c8996fb92427ae41e4649b934ca495991b7852b855",
    "diff_sha256": "e3b0c44298fc1c149afbf4c8996fb92427ae41e4649b934ca495991b7852b855"
  },
  "recipe": {
    "origin": "declared",
    "hash": "6bf3ceb4d34e8da805164ee88cbf6544a660458ebaea23f9dd965cdd67ac5968",
    "checks": [
      {
        "id": "check",
        "command": "bun",
        "args": [
          "run",
          "check"
        ],
        "required": true,
        "timeout_seconds": 1800
      }
    ],
    "selected": [
      "check"
    ]
  },
  "results": [
    {
      "id": "check",
      "command": "bun",
      "args": [
        "run",
        "check"
      ],
      "required": true,
      "status": "passed",
      "exit_code": 0,
      "started_at": "2026-10-06T15:27:09.889Z",
      "duration_ms": 13656,
      "stdout_sha256": "73253cd6bdc0b2feb5d573540efb29d23b761cae5dca89633c5a9fcc7edfb9a0",
      "stderr_sha256": "b922771c07861d7e89b4b944d30177e228f8f5909a196cade477acb4dbc2fbd5",
      "stdout_tail": "\u001b[0m\u001b[34mChecked 53 files in 14\u001b[0m\u001b[0m\u001b[2m\u001b[34mms\u001b[0m\u001b[0m\u001b[34m.\u001b[0m\u001b[0m\u001b[34m No fixes applied.\u001b[0m\nbun test v1.4.0-canary.1 (57f349f63)\n# SUMMARY\n\n* Bad licenses: 0\n* Deprecated licenses: 0\n* Licenses without file extension: 0\n* Missing licenses: 0\n* Unused licenses: 0\n* Used licenses: Apache-2.0\n* Read errors: 0\n* Invalid SPDX License Expressions: 0\n* Files with copyright information: 90 / 90\n* Files with license information: 90 / 90\n\nCongratulations! Your project is compliant with version 3.3 of the REUSE Specification :-)\nno private marker in tracked files\n",
      "stderr_tail": "d declared [0.35ms]\n\ntests/binding.test.ts:\n\ntests/differential-errors.test.ts:\n(pass) runDifferential tooling failures > reports a missing git and a timed-out git without touching the tree [0.31ms]\n\ntests/cli.test.ts:\n(pass) parseArgv > splits command, positionals and flags [0.03ms]\n(pass) evidence CLI > full path on a fixture: init, accept, gate, defect, verify, attach, decide, prune, compare [1151.84ms]\n(pass) evidence CLI > the binary runs under bun and prints JSON [235.48ms]\n\ntests/bundle.test.ts:\n------------------------|---------|---------|-------------------\nFile                    | % Funcs | % Lines | Uncovered Line #s\n------------------------|---------|---------|-------------------\nAll files               |  100.00 |   98.90 |\n extensions/evidence.ts |  100.00 |   97.53 | 68-70,194,204-205,236,257-258\n src/acceptance.ts      |  100.00 |   96.97 | 62-63,96-97\n src/attestation.ts     |  100.00 |   98.74 | 67,214-215\n src/binding.ts         |  100.00 |   98.85 | \n src/bundle.ts          |  100.00 |   98.00 | 85-86\n src/cli.ts             |  100.00 |   96.13 | 130-138,248\n src/compare.ts         |  100.00 |  100.00 | \n src/config.ts          |  100.00 |   96.36 | 115-118\n src/differential.ts    |  100.00 |   99.34 | \n src/discovery.ts       |  100.00 |  100.00 | \n src/environment.ts     |  100.00 |   98.51 | \n src/exec.ts            |  100.00 |  100.00 | \n src/init.ts            |  100.00 |  100.00 | \n src/prune.ts           |  100.00 |   98.08 | \n src/recipe.ts          |  100.00 |  100.00 | \n src/result.ts          |  100.00 |  100.00 | \n src/runner.ts          |  100.00 |  100.00 | \n src/scrub.ts           |  100.00 |  100.00 | \n src/service.ts         |  100.00 |  100.00 | \n src/signer.ts          |  100.00 |  100.00 | \n src/trust.ts           |  100.00 |   97.33 | 94-95\n src/verdict.ts         |  100.00 |  100.00 | \n------------------------|---------|---------|-------------------\n\n 103 pass\n 0 fail\n 661 expect() calls\nRan 103 tests across 24 files. [12.70s]\n$ reuse lint\n$ bun scripts/check-markers.ts\n",
      "log_files": {
        "stdout": "20261006T152709Z-ef02fa4/check.stdout.log",
        "stderr": "20261006T152709Z-ef02fa4/check.stderr.log"
      },
      "redactions": []
    }
  ],
  "verdict": "conformant",
  "reasons": [
    "all required checks passed",
    ".evidence/ is not ignored by git: checks that scan untracked files may fail because of the evidence itself (add it to .gitignore)"
  ],
  "criteria_declared": true,
  "requirement": null,
  "environment": {
    "platform": "darwin",
    "arch": "arm64",
    "lockfiles": {
      "bun.lock": "1fdd99c7ebb99fbfbd4f0ff6a3f113be0feac5105370ff83cac62e7e2d9021ac"
    },
    "node_modules_present": true,
    "fingerprint_sha256": "a91921eb3eeb2aaf17fc1630563e1a09177453626a6d77b2748a852133eb7efe"
  },
  "differential": null,
  "session": {
    "session_id": "cli:19832",
    "provider": "cli",
    "model": "none",
    "thinking_level": null
  },
  "tools": {
    "bun": "1.4.0",
    "node": "v26.10.0",
    "cargo": "cargo 1.97.0 (c980f4866 2026-06-30)"
  }
}
